{
  "action": "close",
  "as_of": "2026-07-05",
  "period": {
    "start": "2026-04-01",
    "end": "2026-06-30"
  },
  "currency": "USD",
  "chart_of_accounts": [
    {
      "account": "receivable",
      "class": "asset",
      "subclass": "receivable"
    },
    {
      "account": "payable",
      "class": "liability",
      "subclass": "payable"
    },
    {
      "account": "owner_equity",
      "class": "equity"
    },
    {
      "account": "sales",
      "class": "revenue"
    },
    {
      "account": "rent",
      "class": "expense"
    },
    {
      "account": "fees",
      "class": "expense",
      "subclass": "non_operating"
    }
  ],
  "opening_balances": [
    {
      "account": "receivable",
      "debit": "1000.00",
      "credit": "0"
    },
    {
      "account": "owner_equity",
      "debit": "0",
      "credit": "1000.00"
    }
  ],
  "journal": [
    {
      "id": "r1",
      "date": "2026-04-15",
      "counterparty": "demo_customer",
      "lines": [
        {
          "account": "receivable",
          "debit": "100.00",
          "credit": "0"
        },
        {
          "account": "sales",
          "debit": "0",
          "credit": "100.00"
        }
      ]
    },
    {
      "id": "r2",
      "date": "2026-05-01",
      "counterparty": "demo_agency",
      "lines": [
        {
          "account": "rent",
          "debit": "300.00",
          "credit": "0"
        },
        {
          "account": "payable",
          "debit": "0",
          "credit": "300.00"
        }
      ]
    },
    {
      "id": "r3",
      "date": "2026-06-01",
      "counterparty": "demo_bank",
      "lines": [
        {
          "account": "fees",
          "debit": "0.50",
          "credit": "0"
        },
        {
          "account": "payable",
          "debit": "0",
          "credit": "0.50"
        }
      ]
    }
  ],
  "prior_journals": [
    {
      "period": {
        "start": "2025-10-01",
        "end": "2025-12-31"
      },
      "journal": [
        {
          "id": "rent-2025-12",
          "date": "2025-12-31",
          "counterparty": "demo_landlord",
          "lines": [
            {
              "account": "rent",
              "debit": "500.00",
              "credit": "0"
            },
            {
              "account": "payable",
              "debit": "0",
              "credit": "500.00"
            }
          ]
        }
      ]
    },
    {
      "period": {
        "start": "2026-01-01",
        "end": "2026-03-31"
      },
      "journal": [
        {
          "id": "rent-2026-03",
          "date": "2026-03-31",
          "counterparty": "demo_landlord",
          "lines": [
            {
              "account": "rent",
              "debit": "500.01",
              "credit": "0"
            },
            {
              "account": "payable",
              "debit": "0",
              "credit": "500.01"
            }
          ]
        }
      ]
    }
  ],
  "options": {
    "soft_close": false,
    "recurrence_min_periods": 2,
    "deviation_threshold": "0.20"
  }
}
